{
  "acceptance_tier": 1,
  "accepted_at": "2026-09-16T13:50:45Z",
  "accepted_by": "codex-release-supervisor",
  "contract": "AcceptanceRecord/v1",
  "gate_outcomes": {
    "authorization": {
      "code": "AUTHORIZATION_VALID",
      "status": "pass"
    },
    "evaluation": {
      "code": "EVAL_PASSED",
      "status": "pass"
    },
    "evidence": {
      "code": "EVIDENCE_SATISFIED",
      "proof": [
        "format v3 or earlier: v4 policy receipts are not required"
      ],
      "status": "pass"
    },
    "preflight": {
      "code": "PREFLIGHT_PASSED",
      "status": "pass",
      "warnings": []
    }
  },
  "outcome": {
    "code": "ACCEPTED_TIER_1",
    "status": "accepted"
  },
  "receipts": [],
  "subject": {
    "attempt_id": "e0427cf9-1b76-4444-906a-8e75e92bbef5",
    "authorization_ref": "hmac-sha256-v3:e2e418a3:c65688c197ab22f5971a63e57a6a146335235cfb3b1e1cf80d02b5248ba055f2",
    "base_commit": "7a3b3c6376b3203202943ad630c9f15bab94c9f0",
    "task_id": "T-20260916-planning-blocker-guidance",
    "task_revision_digest": "sha256:fb4634b54e579ec7696a5f338c57b21f7937e49dc397e5a46245fee785082b09"
  }
}
