{
  "acceptance_tier": 1,
  "accepted_at": "2026-08-16T19:38:24Z",
  "accepted_by": "luanmorenomaciel",
  "contract": "AcceptanceRecord/v1",
  "gate_outcomes": {
    "authorization": {
      "code": "AUTHORIZATION_VALID",
      "status": "pass"
    },
    "evaluation": {
      "code": "EVAL_PASSED",
      "status": "pass"
    },
    "evidence": {
      "code": "EVIDENCE_SATISFIED",
      "proof": [
        "format v3 or earlier: v4 policy receipts are not required"
      ],
      "status": "pass"
    },
    "preflight": {
      "code": "PREFLIGHT_PASSED",
      "status": "pass",
      "warnings": []
    }
  },
  "outcome": {
    "code": "ACCEPTED_TIER_1",
    "status": "accepted"
  },
  "receipts": [],
  "subject": {
    "attempt_id": "412f6f17-ab38-46b5-b2e0-1d1779c73446",
    "authorization_ref": "hmac-sha256-v3:e2e418a3:116f7cbf685d4609b8b35036998bec05dbdd29a716f483069070231578871c6e",
    "base_commit": "7450e77f443f68888296ea4853ef1423f52fc833",
    "task_id": "T-20260816-mesh-daemon-state",
    "task_revision_digest": "sha256:6aa712cae6a2fce0f61d10378340d7c80b3f0fcafcb72ef0120a536de79c1abc"
  }
}
