{
  "acceptance_tier": 1,
  "accepted_at": "2026-09-14T20:58:49Z",
  "accepted_by": "luanmorenomaciel",
  "contract": "AcceptanceRecord/v1",
  "gate_outcomes": {
    "authorization": {
      "code": "AUTHORIZATION_VALID",
      "status": "pass"
    },
    "evaluation": {
      "code": "EVAL_PASSED",
      "status": "pass"
    },
    "evidence": {
      "code": "EVIDENCE_SATISFIED",
      "proof": [
        "format v3 or earlier: v4 policy receipts are not required"
      ],
      "status": "pass"
    },
    "preflight": {
      "code": "PREFLIGHT_PASSED",
      "status": "pass",
      "warnings": []
    }
  },
  "outcome": {
    "code": "ACCEPTED_TIER_1",
    "status": "accepted"
  },
  "receipts": [],
  "subject": {
    "attempt_id": "fce59fe6-ab72-4e5a-a235-1dade4b2dfa6",
    "authorization_ref": "hmac-sha256-v3:971d630c:8340804065669acbfe3c5eba85133c716ad7883a72b61d85c52a0a5421d40eb1",
    "base_commit": "a335466974160704270cddce29f6670f5d841815",
    "task_id": "T-20260914-pilot-small-fix",
    "task_revision_digest": "sha256:f616f953c2a09d1e24c8612e537fa01dccae61be751f930c0526d0eb7cc7a8b1"
  }
}
