{
  "acceptance_tier": 2,
  "accepted_at": "2026-08-18T17:09:45Z",
  "accepted_by": "luan-moreno",
  "contract": "AcceptanceRecord/v1",
  "gate_outcomes": {
    "authorization": {
      "code": "AUTHORIZATION_VALID",
      "status": "pass"
    },
    "evaluation": {
      "code": "EVAL_PASSED",
      "status": "pass"
    },
    "evidence": {
      "code": "EVIDENCE_SATISFIED",
      "proof": [
        "format v3 or earlier: v4 policy receipts are not required"
      ],
      "status": "pass"
    },
    "preflight": {
      "code": "PREFLIGHT_PASSED",
      "status": "pass",
      "warnings": []
    }
  },
  "outcome": {
    "code": "ACCEPTED_TIER_2",
    "status": "accepted"
  },
  "receipts": [],
  "subject": {
    "attempt_id": "0e71cae2-593c-585c-81b7-eba8bc8435ba",
    "authorization_ref": "None",
    "base_commit": "HEAD",
    "task_id": "T-20260818-task-spec-cursor-dest",
    "task_revision_digest": "sha256:e74540c0c0037d135fda12fad82b8c9d65b4e6e0bf7c9cece7fd9907239fc8fd"
  },
  "supervision": {
    "reason": "implementation already on main (efa5349); no HMAC envelope; closing leftover tracking",
    "supervised_by": "luan-moreno"
  }
}
