{
  "acceptance_tier": 1,
  "accepted_at": "2026-09-16T02:42:09Z",
  "accepted_by": "codex-release-supervisor",
  "contract": "AcceptanceRecord/v1",
  "gate_outcomes": {
    "authorization": {
      "code": "AUTHORIZATION_VALID",
      "status": "pass"
    },
    "evaluation": {
      "code": "EVAL_PASSED",
      "status": "pass"
    },
    "evidence": {
      "code": "EVIDENCE_SATISFIED",
      "proof": [
        "format v3 or earlier: v4 policy receipts are not required"
      ],
      "status": "pass"
    },
    "preflight": {
      "code": "PREFLIGHT_PASSED",
      "status": "pass",
      "warnings": []
    }
  },
  "outcome": {
    "code": "ACCEPTED_TIER_1",
    "status": "accepted"
  },
  "receipts": [],
  "subject": {
    "attempt_id": "041010ad-ba64-47e5-a65e-a300ddefec6b",
    "authorization_ref": "hmac-sha256-v3:e2e418a3:3f5b7b63e2b58f098f420751cdea27a10c00d07d1855ced63aa15d2622f93d62",
    "base_commit": "ca97bac151ce6e7a379101898163c4b7b35dd1d4",
    "task_id": "T-20260914-toolkit-packaging",
    "task_revision_digest": "sha256:b4a1ad54bd100f7e10b5cee099d6a23f647076a573fabefa68cd5073efd66cfc"
  }
}
