{
  "acceptance_tier": 1,
  "accepted_at": "2026-08-16T22:56:38Z",
  "accepted_by": "luanmorenomaciel",
  "contract": "AcceptanceRecord/v1",
  "gate_outcomes": {
    "authorization": {
      "code": "AUTHORIZATION_VALID",
      "status": "pass"
    },
    "evaluation": {
      "code": "EVAL_PASSED",
      "status": "pass"
    },
    "evidence": {
      "code": "EVIDENCE_SATISFIED",
      "proof": [
        "format v3 or earlier: v4 policy receipts are not required"
      ],
      "status": "pass"
    },
    "preflight": {
      "code": "PREFLIGHT_PASSED",
      "status": "pass",
      "warnings": []
    }
  },
  "outcome": {
    "code": "ACCEPTED_TIER_1",
    "status": "accepted"
  },
  "receipts": [],
  "subject": {
    "attempt_id": "57c96e14-159a-445d-9d92-3132e0a83d2c",
    "authorization_ref": "hmac-sha256-v3:e2e418a3:7bb5eed55653eda4771b7d4261766e7a5747818030684d9c75ecdb53033f4cd4",
    "base_commit": "4e64cb2b3ada9eee4b17dc7d19e83e6940fc7b54",
    "task_id": "T-20260816-mesh-package-release",
    "task_revision_digest": "sha256:1f345e7913eb02383b706f1e91b39ea83edf3fecf1564e8a7f92494c3ceb9950"
  }
}
