{
  "acceptance_tier": 1,
  "accepted_at": "2026-09-14T21:03:21Z",
  "accepted_by": "luanmorenomaciel",
  "contract": "AcceptanceRecord/v1",
  "gate_outcomes": {
    "authorization": {
      "code": "AUTHORIZATION_VALID",
      "status": "pass"
    },
    "evaluation": {
      "code": "EVAL_PASSED",
      "status": "pass"
    },
    "evidence": {
      "code": "EVIDENCE_SATISFIED",
      "proof": [
        "format v3 or earlier: v4 policy receipts are not required"
      ],
      "status": "pass"
    },
    "preflight": {
      "code": "PREFLIGHT_PASSED",
      "status": "pass",
      "warnings": []
    }
  },
  "outcome": {
    "code": "ACCEPTED_TIER_1",
    "status": "accepted"
  },
  "receipts": [],
  "subject": {
    "attempt_id": "26c4bd3e-fa34-49af-8f1a-278d196ea69e",
    "authorization_ref": "hmac-sha256-v3:607e9815:5df53b4c111a59aa32810a1cebfb464a0d2fcf11b3966c6b187c78f5e80ae7cc",
    "base_commit": "f4e3b02e731929f86244abc068c1a4d83dacd178",
    "task_id": "T-20260914-pilot-overview-skill",
    "task_revision_digest": "sha256:2c58013741801385f5284dd7d31f744ac684bf40252271535d5d1f019f2b9fd4"
  }
}
